{"canonicalization":"fkst-testing-package-schema-release-canonical-json.v1","package_manifest":{"kind":"testing-package-manifest","ref":"immutable://fkst-packages-testing/1.0.0/testing-package-manifest.v1.json","sha256":"f1e7ce497e5c48d232bbb68f9903153fabbdd9382b6784219b732365d00a5ae1"},"producer":{"name":"fkst-packages-testing","version":"1.0.0"},"release_sha256":"e620bd44e0564e02e577b8fd80dc347f6e1df96be9dd04f5f22ed23f21163605","schema":"testing-package-schema-release.v1","schema_catalog":{"kind":"testing-schema-catalog","ref":"immutable://fkst-packages-testing/1.0.0/testing-schema-catalog.v1.json","sha256":"51579736051a23d3ac21731af11ced4a9d283e8cf07ae4579506cf7de61fee3d"}}
